{
  "schemaVersion": 1,
  "incidentId": "incident-phase1-kinesis-smoke",
  "symptom": "not_recorded",
  "rootCause": "not_recorded",
  "fix": "not_recorded",
  "regressionResult": "run_20260710_225534_phase1_kinesis_smoke_retry:passed",
  "affectedRunIds": [
    "run_20260710_225534_phase1_kinesis_smoke_retry"
  ],
  "period": {
    "start": "2026-07-10T22:55:34",
    "end": "2026-07-10T22:55:34",
    "timezone": "not_recorded"
  },
  "invalidationScope": "unknown",
  "provenance": {
    "snapshotId": "snapshot_20260719T200907Z",
    "workspaceArchiveSha256": "773aae45e7ba300535741a79bccd503704d8bc4d4716dbb72e3f59206f808417",
    "sourceEvidence": [
      {
        "path": "run_20260710_225534_phase1_kinesis_smoke_retry/artifacts.md",
        "bytes": 1522,
        "sha256": "474b79d750550c039bb879210cd752b01996a5a085d2fc28fe13f71037bc6e2e"
      },
      {
        "path": "run_20260710_225534_phase1_kinesis_smoke_retry/cleanup-verification.json",
        "bytes": 844,
        "sha256": "39ad301d003aabd085f19517196359e1e0d1cdf96aeb7397b0a49cc3cb421ce6"
      },
      {
        "path": "run_20260710_225534_phase1_kinesis_smoke_retry/commands.md",
        "bytes": 1350,
        "sha256": "6dbd826a79cecf024bbe2ecc0489a447e4516d7fd3ea028aab2b7ca591b65736"
      },
      {
        "path": "run_20260710_225534_phase1_kinesis_smoke_retry/cost-explorer.json",
        "bytes": 939,
        "sha256": "8d57f560fae5e20e716fa30baa152f81ad971339d428b9e0e76e536e6279c264"
      },
      {
        "path": "run_20260710_225534_phase1_kinesis_smoke_retry/cost-realtime.json",
        "bytes": 1468,
        "sha256": "67a243d02ccf967a674a858acb60795eeb07624e14511624b6dddd15bf8a93ac"
      },
      {
        "path": "run_20260710_225534_phase1_kinesis_smoke_retry/cost-upper-bound.json",
        "bytes": 1468,
        "sha256": "68fa621146d4dec2340b4753ce08d57d5dfd2b01e3786ea9a5b567b9011ba671"
      },
      {
        "path": "run_20260710_225534_phase1_kinesis_smoke_retry/cost.md",
        "bytes": 486,
        "sha256": "fcf95467ddee89d38c795931bde67cc95db2003177bd6a2a1a8c42cba1f0accc"
      },
      {
        "path": "run_20260710_225534_phase1_kinesis_smoke_retry/infra.md",
        "bytes": 776,
        "sha256": "74a5078b738dd8ba7c219406eee3c5dfa79d5dc97df828f0e89a498b90743774"
      },
      {
        "path": "run_20260710_225534_phase1_kinesis_smoke_retry/metrics-summary.json",
        "bytes": 2731,
        "sha256": "491b67715c05855c422ff45b88cb6a021725b68a5ea809ead74fc0553af6d5b5"
      },
      {
        "path": "run_20260710_225534_phase1_kinesis_smoke_retry/report.md",
        "bytes": 719,
        "sha256": "2824ada807a522c793a4f0383ee82b52430de5e60fdfc6d5ef2bd05c9190077d"
      },
      {
        "path": "run_20260710_225534_phase1_kinesis_smoke_retry/run.json",
        "bytes": 11210,
        "sha256": "0cfe6912d38b8b495ff85c07e6d2279c67c98f8b6ae29be0606b74443caf1f90"
      }
    ]
  }
}
