{
  "schemaVersion": 1,
  "incidentId": "incident-phase7-20260717-123647",
  "symptom": "not_recorded",
  "rootCause": "not_recorded",
  "fix": "not_recorded",
  "regressionResult": "run_20260717_123647_phase7_2_deployment_readiness:unknown, run_20260717_123647_phase7_2_aws_integration:unknown",
  "affectedRunIds": [
    "run_20260717_123647_phase7_2_aws_integration",
    "run_20260717_123647_phase7_2_deployment_readiness"
  ],
  "period": {
    "start": "2026-07-17T12:36:47",
    "end": "2026-07-17T12:36:47",
    "timezone": "not_recorded"
  },
  "invalidationScope": "unknown",
  "provenance": {
    "snapshotId": "snapshot_20260719T200907Z",
    "workspaceArchiveSha256": "773aae45e7ba300535741a79bccd503704d8bc4d4716dbb72e3f59206f808417",
    "sourceEvidence": [
      {
        "path": "run_20260717_123647_phase7_2_aws_integration/cleanup-verification.json",
        "bytes": 2648,
        "sha256": "eed6c837f6b43803f60ece1f6272ab3f1562eca95c18553f3e0099d10b27a123"
      },
      {
        "path": "run_20260717_123647_phase7_2_aws_integration/commands.md",
        "bytes": 1079,
        "sha256": "d442e2f1b209a394a42d32af48a718539b034b380fbb5e028cae680e85cbef2a"
      },
      {
        "path": "run_20260717_123647_phase7_2_aws_integration/correctness-summary.json",
        "bytes": 623,
        "sha256": "190428e63c2542c598083eeb93faf0edee30196aa54fb27f90da6010fb327129"
      },
      {
        "path": "run_20260717_123647_phase7_2_aws_integration/cost-summary.json",
        "bytes": 700,
        "sha256": "61efa62fbc4e36b8e14b3d37b4f439607ef27f1caf042a3eb35eede6df93d2a7"
      },
      {
        "path": "run_20260717_123647_phase7_2_aws_integration/infra.md",
        "bytes": 1081,
        "sha256": "1ee77be1b8accbf67f0e9857c4baff70a82dee3ebf439b69d3662bf4316c7afd"
      },
      {
        "path": "run_20260717_123647_phase7_2_aws_integration/metrics-summary.json",
        "bytes": 638,
        "sha256": "bc843f020925a14d54aa57049ae07fd3898ba30a7e49d67a43a7da16a5c47235"
      },
      {
        "path": "run_20260717_123647_phase7_2_aws_integration/report.md",
        "bytes": 4689,
        "sha256": "d85f59d85272be8da5f111e816d00569bd5f0effbfae6dab52a128c4da9437cd"
      },
      {
        "path": "run_20260717_123647_phase7_2_aws_integration/run.json",
        "bytes": 813,
        "sha256": "aefba546512b703d10edd7b01de8483774b910486f86342475feeeab65790d8c"
      },
      {
        "path": "run_20260717_123647_phase7_2_deployment_readiness/commands.md",
        "bytes": 1373,
        "sha256": "c43f96ba1987a35cd25e056b828a64fd1b8620d497e7bd1c51192c8322a6c12d"
      },
      {
        "path": "run_20260717_123647_phase7_2_deployment_readiness/cost-model.json",
        "bytes": 7438,
        "sha256": "5802984825cf7bf55772c471c0fa2a597976793e357ac532060be0e502dda1b8"
      },
      {
        "path": "run_20260717_123647_phase7_2_deployment_readiness/report.md",
        "bytes": 1688,
        "sha256": "a6577fcd7d6be42038f3f6f7fc13e03364df0a8d6d57348181ecdf6cc89586e2"
      },
      {
        "path": "run_20260717_123647_phase7_2_deployment_readiness/run.json",
        "bytes": 738,
        "sha256": "17bc1b4c1fc3ee3f975a582327ca5a7f09ab788036f3e3f33c4e4e9f77e08e67"
      }
    ]
  }
}
