{
  "schemaVersion": 1,
  "incidentId": "incident-phase7-20260717-114232",
  "symptom": "not_recorded",
  "rootCause": "not_recorded",
  "fix": "not_recorded",
  "regressionResult": "run_20260717_114232_phase7_2_deployment_readiness:failed",
  "affectedRunIds": [
    "run_20260717_114232_phase7_2_deployment_readiness"
  ],
  "period": {
    "start": "2026-07-17T11:42:32",
    "end": "2026-07-17T11:42:32",
    "timezone": "not_recorded"
  },
  "invalidationScope": "unknown",
  "provenance": {
    "snapshotId": "snapshot_20260719T200907Z",
    "workspaceArchiveSha256": "773aae45e7ba300535741a79bccd503704d8bc4d4716dbb72e3f59206f808417",
    "sourceEvidence": [
      {
        "path": "run_20260717_114232_phase7_2_deployment_readiness/cleanup-verification.json",
        "bytes": 1742,
        "sha256": "467505092c0e4e290882eb55fd3ffad83d2555e120287eadbc69ba7e88973e67"
      },
      {
        "path": "run_20260717_114232_phase7_2_deployment_readiness/commands.md",
        "bytes": 418,
        "sha256": "d0cdb4e266b87b6680caeb479a4d312a8ecca1452112e696c2eb87ce2b540600"
      },
      {
        "path": "run_20260717_114232_phase7_2_deployment_readiness/report.md",
        "bytes": 693,
        "sha256": "b2613597d13834e91c364ccb3b5ca3e6864a88088a3f4a73228553eea9c7eea8"
      },
      {
        "path": "run_20260717_114232_phase7_2_deployment_readiness/run.json",
        "bytes": 430,
        "sha256": "4ba12a4fdd26ef2f332b21caac7eca3acb7c980d30a4f91793c31848c6a7975c"
      }
    ]
  }
}
