{
  "schemaVersion": 1,
  "incidentId": "incident-phase7-20260719-043415",
  "symptom": "not_recorded",
  "rootCause": "not_recorded",
  "fix": "not_recorded",
  "regressionResult": "run_20260719_043415_phase7_2_deployment_readiness:unknown, run_20260719_043415_phase7_2_aws_integration:unknown",
  "affectedRunIds": [
    "run_20260719_043415_phase7_2_aws_integration",
    "run_20260719_043415_phase7_2_deployment_readiness"
  ],
  "period": {
    "start": "2026-07-19T04:34:15",
    "end": "2026-07-19T04:34:15",
    "timezone": "not_recorded"
  },
  "invalidationScope": "unknown",
  "provenance": {
    "snapshotId": "snapshot_20260719T200907Z",
    "workspaceArchiveSha256": "773aae45e7ba300535741a79bccd503704d8bc4d4716dbb72e3f59206f808417",
    "sourceEvidence": [
      {
        "path": "run_20260719_043415_phase7_2_aws_integration/cleanup-verification.json",
        "bytes": 1251,
        "sha256": "10a4dc3b1727a6e22c8f694455df1f0ab5fd5a534871a079269125b06a8cbb0d"
      },
      {
        "path": "run_20260719_043415_phase7_2_aws_integration/commands.md",
        "bytes": 565,
        "sha256": "036c5945078bb1dab0cefaa4b2530014d3017d2f17f1a13741ff7c4da1ade0c0"
      },
      {
        "path": "run_20260719_043415_phase7_2_aws_integration/correctness-summary.json",
        "bytes": 2463,
        "sha256": "8c657863e3225ce9a059c36ce159ce331e8c5b0295d3f9545124f4de7fdc87f5"
      },
      {
        "path": "run_20260719_043415_phase7_2_aws_integration/cost-status.json",
        "bytes": 828,
        "sha256": "bfec38cc0b7d858df91e4da348c96351be64aa5a5806129d887a67ee0d6af1b1"
      },
      {
        "path": "run_20260719_043415_phase7_2_aws_integration/infra.md",
        "bytes": 827,
        "sha256": "c8910488b771c429342448d2ea882e8dd810cc2baf7de67313512f5bfa4e4ad3"
      },
      {
        "path": "run_20260719_043415_phase7_2_aws_integration/metrics-summary.json",
        "bytes": 1405,
        "sha256": "672d27d28c9c79e0d698c52f8a0ea16583303673e7d8244df2ffad093adc1c7f"
      },
      {
        "path": "run_20260719_043415_phase7_2_aws_integration/report.md",
        "bytes": 1393,
        "sha256": "e5924878b2432d276145f99108db2c7572bf9986acbc1b3b0f17cc61126feaf6"
      },
      {
        "path": "run_20260719_043415_phase7_2_aws_integration/run.json",
        "bytes": 5288,
        "sha256": "519b6f57456317e4beb69872030b7383d14637679753d5731c752e12285f8e9b"
      },
      {
        "path": "run_20260719_043415_phase7_2_deployment_readiness/commands.md",
        "bytes": 7128,
        "sha256": "e1cf0870b96c0a14cf18dc1175448b315f334049ff7d68cb1375a54ff9a6d0ba"
      },
      {
        "path": "run_20260719_043415_phase7_2_deployment_readiness/cost-model-final.json",
        "bytes": 7686,
        "sha256": "1e512589c7c68cc10d8f669cf54ab72c56ba6844a11a8f21e3c05b021aa6e899"
      },
      {
        "path": "run_20260719_043415_phase7_2_deployment_readiness/cost-model.json",
        "bytes": 7686,
        "sha256": "1e65390ab40cf4e19b23ee9dcc0c8eea30c4c9cb52682981bf6df2decf47dc1d"
      },
      {
        "path": "run_20260719_043415_phase7_2_deployment_readiness/report.md",
        "bytes": 1529,
        "sha256": "ed5f719dbd5cb1ad3f9c885d37e7600bf2d8f555789b7d74182b22a9ef0500ca"
      }
    ]
  }
}
