{
  "schemaVersion": 1,
  "incidentId": "incident-phase1-kinesis-2c-10k",
  "symptom": "not_recorded",
  "rootCause": "not_recorded",
  "fix": "not_recorded",
  "regressionResult": "run_20260711_013903_phase1_kinesis_2c_10k_retry:failed, run_20260711_015921_phase1_kinesis_2c_10k_retry2:failed, run_20260711_101443_phase1_kinesis_2c_10k_retry3:failed",
  "affectedRunIds": [
    "run_20260711_013903_phase1_kinesis_2c_10k_retry",
    "run_20260711_015921_phase1_kinesis_2c_10k_retry2",
    "run_20260711_101443_phase1_kinesis_2c_10k_retry3"
  ],
  "period": {
    "start": "2026-07-11T01:39:03",
    "end": "2026-07-11T10:14:43",
    "timezone": "not_recorded"
  },
  "invalidationScope": "unknown",
  "provenance": {
    "snapshotId": "snapshot_20260719T200907Z",
    "workspaceArchiveSha256": "773aae45e7ba300535741a79bccd503704d8bc4d4716dbb72e3f59206f808417",
    "sourceEvidence": [
      {
        "path": "run_20260711_013903_phase1_kinesis_2c_10k_retry/artifacts.md",
        "bytes": 651,
        "sha256": "5eca9749ac1fc15090d9442284c16404a20a0c7ea5fef9512482b201ca3860c5"
      },
      {
        "path": "run_20260711_013903_phase1_kinesis_2c_10k_retry/cleanup-verification.json",
        "bytes": 1019,
        "sha256": "36ba6b471f4fc2816703c6ca07f1b5cffab6b6719b105fe00ab4f50241eea8c9"
      },
      {
        "path": "run_20260711_013903_phase1_kinesis_2c_10k_retry/commands.md",
        "bytes": 1472,
        "sha256": "3bb114b3eb6da8bbc0332c67c3551cd59c2df1bdc278937b02c05b90dcc01c3e"
      },
      {
        "path": "run_20260711_013903_phase1_kinesis_2c_10k_retry/cost-explorer.json",
        "bytes": 939,
        "sha256": "75d0b5ae6a554d51952732a4077c73c6f04f10006af6585fb264dff18e4ab279"
      },
      {
        "path": "run_20260711_013903_phase1_kinesis_2c_10k_retry/cost-realtime.json",
        "bytes": 1457,
        "sha256": "3c8665ff323534e8dbb5b97aa84cfa09a3f312ddff1a18770ba92bc2fb213e6e"
      },
      {
        "path": "run_20260711_013903_phase1_kinesis_2c_10k_retry/cost-upper-bound.json",
        "bytes": 1508,
        "sha256": "fa675c3f7aa8273634d987fc82dc080c67663cd736a1c28eb4f4b2e4ed1b6bc2"
      },
      {
        "path": "run_20260711_013903_phase1_kinesis_2c_10k_retry/cost.md",
        "bytes": 487,
        "sha256": "a0e7ec2db428fcadf0b5f710e2de08ee9e2d5f1957501b39ab5681215d7c2ca4"
      },
      {
        "path": "run_20260711_013903_phase1_kinesis_2c_10k_retry/infra.md",
        "bytes": 881,
        "sha256": "d829c7d6e16eae8f53e4a9d475b350b7fe4a4dcea091e3010774aedd9a7c02ba"
      },
      {
        "path": "run_20260711_013903_phase1_kinesis_2c_10k_retry/metrics-summary.json",
        "bytes": 871,
        "sha256": "1fb3a79cf1ae3525280582fd611bdca6e6489ee40193d5a627c9c7b07be4adf0"
      },
      {
        "path": "run_20260711_013903_phase1_kinesis_2c_10k_retry/report.md",
        "bytes": 1170,
        "sha256": "13391c4e4e9e6aa56a3e42b375058d19c36134008f821806beab3a52585f76e9"
      },
      {
        "path": "run_20260711_013903_phase1_kinesis_2c_10k_retry/run.json",
        "bytes": 9763,
        "sha256": "9dd3ff170f43ab31d3912e8deb2e52a96c4175ea79daefc3fcc990f8761b5391"
      },
      {
        "path": "run_20260711_015921_phase1_kinesis_2c_10k_retry2/artifacts.md",
        "bytes": 652,
        "sha256": "d7f9b99cdd4f7a4ebdfbacd9f44ca0daafadf70cce227a02638f0ee850bd1458"
      },
      {
        "path": "run_20260711_015921_phase1_kinesis_2c_10k_retry2/cleanup-verification.json",
        "bytes": 1020,
        "sha256": "9ccadb7813f2396caa3ca37b3aca90bd14cfeb036d5ebe20537501405512703b"
      },
      {
        "path": "run_20260711_015921_phase1_kinesis_2c_10k_retry2/commands.md",
        "bytes": 1474,
        "sha256": "e2e5ad306b888cac14bcf8408b8fd2b2b126c39c2a1d3e37bec097139f618b5b"
      },
      {
        "path": "run_20260711_015921_phase1_kinesis_2c_10k_retry2/cost-explorer.json",
        "bytes": 939,
        "sha256": "cc06f3974078752e76f90a8b4afbbe739e58a82895650a2b8e17bb87afcb232f"
      },
      {
        "path": "run_20260711_015921_phase1_kinesis_2c_10k_retry2/cost-realtime.json",
        "bytes": 1461,
        "sha256": "e07abfa174e2c2000df5fafb6111e2b59cb00f8776c5945a10e1a4d364726383"
      },
      {
        "path": "run_20260711_015921_phase1_kinesis_2c_10k_retry2/cost-upper-bound.json",
        "bytes": 1508,
        "sha256": "530b1dc478da15cc204fd39fe5a1b2850152d82e2b15ab1d9e60b41661c5a6b4"
      },
      {
        "path": "run_20260711_015921_phase1_kinesis_2c_10k_retry2/cost.md",
        "bytes": 488,
        "sha256": "a14fc4724798b092eb3650ffdc257abd819296707f3137e51bd89905062b8069"
      },
      {
        "path": "run_20260711_015921_phase1_kinesis_2c_10k_retry2/infra.md",
        "bytes": 882,
        "sha256": "28f73e2d4354497fc30a7ba7561f24535321bbeccee83b5417deed6ccc2a0ca7"
      },
      {
        "path": "run_20260711_015921_phase1_kinesis_2c_10k_retry2/metrics-summary.json",
        "bytes": 939,
        "sha256": "3feb9ebdfaab643f4d300e911be45f5e9bf9fdbe052d8556ad93f4e376d215c9"
      },
      {
        "path": "run_20260711_015921_phase1_kinesis_2c_10k_retry2/report.md",
        "bytes": 1163,
        "sha256": "dfa8167b9c0d6ec1de4489661a1c10fe14208f4b1a6c1a40616452bd607ad98e"
      },
      {
        "path": "run_20260711_015921_phase1_kinesis_2c_10k_retry2/run.json",
        "bytes": 9834,
        "sha256": "f613dae81f57c459850d0d974390c923ed788de27cbe126c3d497d47d8689d00"
      },
      {
        "path": "run_20260711_101443_phase1_kinesis_2c_10k_retry3/artifacts.md",
        "bytes": 2876,
        "sha256": "19347bf946a098419320c3875d51821e9d6944545852ff0f0895511f89a8d4ff"
      },
      {
        "path": "run_20260711_101443_phase1_kinesis_2c_10k_retry3/cleanup-verification.json",
        "bytes": 1020,
        "sha256": "7c7de16efa2ae4b6d592f0dc891c3178cb53355fa82a3259483b1ca8d475b1e0"
      },
      {
        "path": "run_20260711_101443_phase1_kinesis_2c_10k_retry3/commands.md",
        "bytes": 1474,
        "sha256": "c115fc9abbb733c172822f060a7ebf211664bb12c4e12467cf37218b74816248"
      },
      {
        "path": "run_20260711_101443_phase1_kinesis_2c_10k_retry3/cost-explorer.json",
        "bytes": 487,
        "sha256": "bc0b649ba5564bc74a33c853457de85f6e0ff43b893e0668b72485bddd278848"
      },
      {
        "path": "run_20260711_101443_phase1_kinesis_2c_10k_retry3/cost-realtime.json",
        "bytes": 1527,
        "sha256": "601dca62936f054ec635ff2e2f3d73a96354222cd8177844a6058958d6874da3"
      },
      {
        "path": "run_20260711_101443_phase1_kinesis_2c_10k_retry3/cost-upper-bound.json",
        "bytes": 1525,
        "sha256": "e52849cdccdca03972e2be2c48fffb3492ee19e52847ef9a79cd4a0f807910bc"
      },
      {
        "path": "run_20260711_101443_phase1_kinesis_2c_10k_retry3/cost.md",
        "bytes": 483,
        "sha256": "c41bacc6f2ef104176baace86bf22c5d118289c67dd97909096fc7aa2f859920"
      },
      {
        "path": "run_20260711_101443_phase1_kinesis_2c_10k_retry3/infra.md",
        "bytes": 881,
        "sha256": "eaea81a8b8de17301f0acb684d4fdf3f9e444b03ec05d8aefa080375913a3c59"
      },
      {
        "path": "run_20260711_101443_phase1_kinesis_2c_10k_retry3/metrics-summary.json",
        "bytes": 3308,
        "sha256": "1a4a08bdf79acdf326880341573b34bf750a46169b85b5d3b15050b2e3e713bd"
      },
      {
        "path": "run_20260711_101443_phase1_kinesis_2c_10k_retry3/report.md",
        "bytes": 1110,
        "sha256": "2c0b5fde1a8c3a4be0c2f15623800cb6e0928516f6491549e8109dc7b76f072e"
      },
      {
        "path": "run_20260711_101443_phase1_kinesis_2c_10k_retry3/run.json",
        "bytes": 11946,
        "sha256": "a1046b911f3ee434eb77a8a60a3719af335e4218712f72a42892d0d228d9de2f"
      }
    ]
  }
}
