{
  "schemaVersion": 1,
  "incidentId": "incident-phase7-20260718-144405",
  "symptom": "not_recorded",
  "rootCause": "not_recorded",
  "fix": "not_recorded",
  "regressionResult": "run_20260718_144405_phase7_2_deployment_readiness:unknown, run_20260718_144405_phase7_2_aws_integration:unknown",
  "affectedRunIds": [
    "run_20260718_144405_phase7_2_aws_integration",
    "run_20260718_144405_phase7_2_deployment_readiness"
  ],
  "period": {
    "start": "2026-07-18T14:44:05",
    "end": "2026-07-18T14:44:05",
    "timezone": "not_recorded"
  },
  "invalidationScope": "unknown",
  "provenance": {
    "snapshotId": "snapshot_20260719T200907Z",
    "workspaceArchiveSha256": "773aae45e7ba300535741a79bccd503704d8bc4d4716dbb72e3f59206f808417",
    "sourceEvidence": [
      {
        "path": "run_20260718_144405_phase7_2_aws_integration/cleanup-verification.json",
        "bytes": 638,
        "sha256": "495ed1c98757db0df53e61f3142ded1447182f2ebf0acd812a8b2c69c2f71a6b"
      },
      {
        "path": "run_20260718_144405_phase7_2_aws_integration/commands.md",
        "bytes": 1518,
        "sha256": "102638353677d28bfd4a8bb5e59584c2ab440057e195ddfc089e9d49b8b47bd0"
      },
      {
        "path": "run_20260718_144405_phase7_2_aws_integration/infra.md",
        "bytes": 922,
        "sha256": "6c98b7caa211a1abf7917df28e5aed93084696c2a39a6661a5aa93686f0a6dfd"
      },
      {
        "path": "run_20260718_144405_phase7_2_aws_integration/report.md",
        "bytes": 1546,
        "sha256": "2573e1f10f7d8766577b09e2875241d27d39ca63a2b950944f4b31009342d7a9"
      },
      {
        "path": "run_20260718_144405_phase7_2_aws_integration/run.json",
        "bytes": 3619,
        "sha256": "85a287e70c4cb8b4ece4a7cf28f75e26cd4b5e1ee52c43122af03cfeb6232640"
      },
      {
        "path": "run_20260718_144405_phase7_2_deployment_readiness/commands.md",
        "bytes": 4031,
        "sha256": "e870d14584f1adb975e25442cd5535a170601538862234d4165f1736ba5126ee"
      },
      {
        "path": "run_20260718_144405_phase7_2_deployment_readiness/cost-model-final.json",
        "bytes": 7686,
        "sha256": "5f06356ad7e4efeacb0eadf8e46e8012a05f497abe7dd5664c5f79d360eb0b13"
      },
      {
        "path": "run_20260718_144405_phase7_2_deployment_readiness/cost-model.json",
        "bytes": 7686,
        "sha256": "d717dc4e147c779c4d7aa60d9bda6e1da153b8682ec5ab374d2fdbfe1497e362"
      },
      {
        "path": "run_20260718_144405_phase7_2_deployment_readiness/report.md",
        "bytes": 1830,
        "sha256": "830ec74ec71dabac65482fbad9139c8e695bbf1a626a0f6babab79614600ffe7"
      }
    ]
  }
}
