{
  "schemaVersion": 1,
  "incidentId": "incident-phase7-20260718-175720",
  "symptom": "not_recorded",
  "rootCause": "not_recorded",
  "fix": "not_recorded",
  "regressionResult": "run_20260718_175720_phase7_2_deployment_readiness:unknown, run_20260718_175720_phase7_2_aws_integration:unknown",
  "affectedRunIds": [
    "run_20260718_175720_phase7_2_aws_integration",
    "run_20260718_175720_phase7_2_deployment_readiness"
  ],
  "period": {
    "start": "2026-07-18T17:57:20",
    "end": "2026-07-18T17:57:20",
    "timezone": "not_recorded"
  },
  "invalidationScope": "unknown",
  "provenance": {
    "snapshotId": "snapshot_20260719T200907Z",
    "workspaceArchiveSha256": "773aae45e7ba300535741a79bccd503704d8bc4d4716dbb72e3f59206f808417",
    "sourceEvidence": [
      {
        "path": "run_20260718_175720_phase7_2_aws_integration/cleanup-verification.json",
        "bytes": 867,
        "sha256": "8db7f2575d630142956c254e5f0f1c8282573189034cf133eb9dafd3e785b791"
      },
      {
        "path": "run_20260718_175720_phase7_2_aws_integration/commands.md",
        "bytes": 1721,
        "sha256": "0ad755aa4fdc9baa165cfd928ec99d60cabfb67250fafd20de7c68ce977608a3"
      },
      {
        "path": "run_20260718_175720_phase7_2_aws_integration/cost-status.json",
        "bytes": 692,
        "sha256": "1f2a7f299c68280cc0c7203540a806c95e8299d6175979306b29464d45810aa8"
      },
      {
        "path": "run_20260718_175720_phase7_2_aws_integration/infra.md",
        "bytes": 1078,
        "sha256": "5fe71e2e4188bec9c29c79f918b0d3ea0684095c4d4efdb9f89bb6469ba6c388"
      },
      {
        "path": "run_20260718_175720_phase7_2_aws_integration/report.md",
        "bytes": 1693,
        "sha256": "038d4f9cd7fd71916978017f778c90d2439bf3fd861d83fce38822bb7bf75a9a"
      },
      {
        "path": "run_20260718_175720_phase7_2_aws_integration/run.json",
        "bytes": 3619,
        "sha256": "01580c7d50d19de96dbca1a74e0757afb12638a41d106c16690ecf3f7ee309be"
      },
      {
        "path": "run_20260718_175720_phase7_2_deployment_readiness/commands.md",
        "bytes": 4200,
        "sha256": "53f529a1c627e28f5991f3238e6ca33b829512369fe075e9982198daa76a7850"
      },
      {
        "path": "run_20260718_175720_phase7_2_deployment_readiness/cost-model-final.json",
        "bytes": 7687,
        "sha256": "39a31e661a6de33e943390648d13f170f5e970ca500c67db13165dfc7aa8bb3a"
      },
      {
        "path": "run_20260718_175720_phase7_2_deployment_readiness/cost-model.json",
        "bytes": 7687,
        "sha256": "7f7901f4a32b9f008ad9e9cb770cd86a82b8ce09895548d97c0f5cf77a0cbdda"
      },
      {
        "path": "run_20260718_175720_phase7_2_deployment_readiness/report.md",
        "bytes": 1406,
        "sha256": "97dd49c5819330f47be3c58bfe37c4431a0208771b2a36d1b98cd65a56712b38"
      }
    ]
  }
}
