{
  "schemaVersion": 1,
  "incidentId": "incident-phase7-20260718-124510",
  "symptom": "not_recorded",
  "rootCause": "not_recorded",
  "fix": "not_recorded",
  "regressionResult": "run_20260718_124510_phase7_2_deployment_readiness:unknown, run_20260718_124510_phase7_2_aws_integration:unknown",
  "affectedRunIds": [
    "run_20260718_124510_phase7_2_aws_integration",
    "run_20260718_124510_phase7_2_deployment_readiness"
  ],
  "period": {
    "start": "2026-07-18T12:45:10",
    "end": "2026-07-18T12:45:10",
    "timezone": "not_recorded"
  },
  "invalidationScope": "unknown",
  "provenance": {
    "snapshotId": "snapshot_20260719T200907Z",
    "workspaceArchiveSha256": "773aae45e7ba300535741a79bccd503704d8bc4d4716dbb72e3f59206f808417",
    "sourceEvidence": [
      {
        "path": "run_20260718_124510_phase7_2_aws_integration/cleanup-verification.json",
        "bytes": 2330,
        "sha256": "2b18a8c1defb84be45e502a4ec409f90756ab7d54f65cb4268a20a05edf2429a"
      },
      {
        "path": "run_20260718_124510_phase7_2_aws_integration/commands.md",
        "bytes": 504,
        "sha256": "a4b41575072ec651c745b4d8c1d35d7f7c3a8ef4de0e262ab42ed94e9965a11a"
      },
      {
        "path": "run_20260718_124510_phase7_2_aws_integration/cost-status.json",
        "bytes": 637,
        "sha256": "23dc5c74902657eec42186da0fdcb0f3c1241712cc2ed3ad11905086d5cba57b"
      },
      {
        "path": "run_20260718_124510_phase7_2_aws_integration/infra.md",
        "bytes": 1353,
        "sha256": "ad893fa50d9beb7cb6710d6747bec729b472614fbb60937e4b8b2d6479621619"
      },
      {
        "path": "run_20260718_124510_phase7_2_aws_integration/report.md",
        "bytes": 1128,
        "sha256": "bee6017e47ada15512d313657eecaad35a30cd176c40fff9f250762fb0557294"
      },
      {
        "path": "run_20260718_124510_phase7_2_aws_integration/run.json",
        "bytes": 3619,
        "sha256": "10b17bbdffada6e0e95c7967dd64ca3573e0aadc1d70f75f1eb59cf1ac349695"
      },
      {
        "path": "run_20260718_124510_phase7_2_deployment_readiness/commands.md",
        "bytes": 2957,
        "sha256": "15603bc9df22b33b896872301797ec0f72762d4cea331ac27be6bc68f0831e3c"
      },
      {
        "path": "run_20260718_124510_phase7_2_deployment_readiness/cost-model-final.json",
        "bytes": 7687,
        "sha256": "faa07633adb4d3fff673d224006e0ab6c5299fd03866830ecaecb67aa6613669"
      },
      {
        "path": "run_20260718_124510_phase7_2_deployment_readiness/cost-model.json",
        "bytes": 7687,
        "sha256": "d6e83087dd97b7b507e8c7826b2b5d9e2a898077011c2782ea4952d0fefa97e8"
      },
      {
        "path": "run_20260718_124510_phase7_2_deployment_readiness/report.md",
        "bytes": 1503,
        "sha256": "f80633849871e1fa3ca69c36624bf19712601ee16051edf015b83f92ea8df8d3"
      }
    ]
  }
}
