{
  "schemaVersion": 1,
  "incidentId": "incident-phase7-20260718-210703",
  "symptom": "not_recorded",
  "rootCause": "not_recorded",
  "fix": "not_recorded",
  "regressionResult": "run_20260718_210703_phase7_2_deployment_readiness:unknown, run_20260718_210703_phase7_2_aws_integration:unknown",
  "affectedRunIds": [
    "run_20260718_210703_phase7_2_aws_integration",
    "run_20260718_210703_phase7_2_deployment_readiness"
  ],
  "period": {
    "start": "2026-07-18T21:07:03",
    "end": "2026-07-18T21:07:03",
    "timezone": "not_recorded"
  },
  "invalidationScope": "unknown",
  "provenance": {
    "snapshotId": "snapshot_20260719T200907Z",
    "workspaceArchiveSha256": "773aae45e7ba300535741a79bccd503704d8bc4d4716dbb72e3f59206f808417",
    "sourceEvidence": [
      {
        "path": "run_20260718_210703_phase7_2_aws_integration/cleanup-verification.json",
        "bytes": 899,
        "sha256": "de85426e06aecaf7fb9bc91b049027aa1fce783c864f1d6ec71afa98a94357f9"
      },
      {
        "path": "run_20260718_210703_phase7_2_aws_integration/commands.md",
        "bytes": 1609,
        "sha256": "c715756d56e193c6484bc81dfbf0f0c51336b7e8bfdbf778ac34fe323f3b63bb"
      },
      {
        "path": "run_20260718_210703_phase7_2_aws_integration/correctness-summary.json",
        "bytes": 2462,
        "sha256": "a40f1f0702e50ced264d28700306e25d23c0867d018d20e349c89b27867127ce"
      },
      {
        "path": "run_20260718_210703_phase7_2_aws_integration/cost-status.json",
        "bytes": 563,
        "sha256": "931701a60262bd91183c62fd81ae6063e1b6d62df22d9fb98ec0f9f3114ca948"
      },
      {
        "path": "run_20260718_210703_phase7_2_aws_integration/infra.md",
        "bytes": 1282,
        "sha256": "4044585cca67dc26704e4491d985d1efcce5ac8345566e9ffd97f0b6805dd77e"
      },
      {
        "path": "run_20260718_210703_phase7_2_aws_integration/report.md",
        "bytes": 2003,
        "sha256": "cd669a67d8a23b44ef8cb7d09295f09d59697cf94a80256fb68c35a383a6c4f5"
      },
      {
        "path": "run_20260718_210703_phase7_2_aws_integration/run.json",
        "bytes": 4857,
        "sha256": "aacf8864e3807e4258de02d737e57321baabe4b2085e2dc3830e1271ed408d67"
      },
      {
        "path": "run_20260718_210703_phase7_2_deployment_readiness/commands.md",
        "bytes": 4106,
        "sha256": "a9de529c5ae14a78dea5e28a4edd2ceb040fd1280aa5c71be6442ae9e726859a"
      },
      {
        "path": "run_20260718_210703_phase7_2_deployment_readiness/cost-model-final.json",
        "bytes": 7686,
        "sha256": "491366398a4745628763a2b9c4f470e1a946580c0c7093b6c77d6e330ebc46e5"
      },
      {
        "path": "run_20260718_210703_phase7_2_deployment_readiness/cost-model.json",
        "bytes": 7686,
        "sha256": "09f2329c8bb38199506f3749515cb1892dad08d96cf0e6cc9b3441ebd23f10d1"
      },
      {
        "path": "run_20260718_210703_phase7_2_deployment_readiness/report.md",
        "bytes": 1682,
        "sha256": "ad85c28ae0402b600f4367e645b433a3791ddd3fb895723508a87010791fe688"
      }
    ]
  }
}
