{
  "schemaVersion": 1,
  "incidentId": "incident-phase7-20260719-164311",
  "symptom": "not_recorded",
  "rootCause": "not_recorded",
  "fix": "not_recorded",
  "regressionResult": "run_20260719_164311_phase7_2_deployment_readiness:unknown, run_20260719_164311_phase7_2_aws_integration:unknown",
  "affectedRunIds": [
    "run_20260719_164311_phase7_2_aws_integration",
    "run_20260719_164311_phase7_2_deployment_readiness"
  ],
  "period": {
    "start": "2026-07-19T16:43:11",
    "end": "2026-07-19T16:43:11",
    "timezone": "not_recorded"
  },
  "invalidationScope": "unknown",
  "provenance": {
    "snapshotId": "snapshot_20260719T200907Z",
    "workspaceArchiveSha256": "773aae45e7ba300535741a79bccd503704d8bc4d4716dbb72e3f59206f808417",
    "sourceEvidence": [
      {
        "path": "run_20260719_164311_phase7_2_aws_integration/cleanup-verification.json",
        "bytes": 2492,
        "sha256": "fb5cbcfef347aa99621bfd7a385723deed88394c7861ae1695355e845208d1d3"
      },
      {
        "path": "run_20260719_164311_phase7_2_aws_integration/commands.md",
        "bytes": 396,
        "sha256": "2182198116cd7221acbcf50297a3c52ce0f819654d089c02bede0f218e77b645"
      },
      {
        "path": "run_20260719_164311_phase7_2_aws_integration/infra.md",
        "bytes": 178,
        "sha256": "9cf52535ef1b68ab8a995b67337b7c67470410fc9d8f5a893af6ce1f9c2ea979"
      },
      {
        "path": "run_20260719_164311_phase7_2_aws_integration/report.md",
        "bytes": 377,
        "sha256": "1a1f81badb06d049efb3bb5261b5991324351219bc902348ea73c7a2c3855dc3"
      },
      {
        "path": "run_20260719_164311_phase7_2_aws_integration/run.json",
        "bytes": 3636,
        "sha256": "8faf18d8e25de00d219370575b527350085cb1161c50da103da428bbb2478227"
      },
      {
        "path": "run_20260719_164311_phase7_2_deployment_readiness/commands.md",
        "bytes": 1936,
        "sha256": "23acbce182709fa42ad68c6306560cb8bd510fb719f1c11a9ae1ec9876c40543"
      },
      {
        "path": "run_20260719_164311_phase7_2_deployment_readiness/cost-model.json",
        "bytes": 13368,
        "sha256": "2767ecc88c40331d419c6a181f55f07ca6c563144f9e5f014f894e3b3dded4a1"
      }
    ]
  }
}
